smartctl 7.4 2023-08-01 r5530 [x86_64-linux-6.8.0-45-generic] (local build)
Copyright (C) 2002-23, Bruce Allen, Christian Franke, www.smartmontools.org

=== START OF INFORMATION SECTION ===
Model Family:     Seagate Constellation ES.3
Device Model:     ST2000NM0033-9ZM175
Serial Number:    Z1X2ABCD
LU WWN Device Id: 5 000c50 07a1b2c3d
Firmware Version: SN04
User Capacity:    2 000 398 934 016 bytes [2,00 TB]
Sector Sizes:     512 bytes logical, 4096 bytes physical
Rotation Rate:    7200 rpm
Form Factor:      3.5 inches
Device is:        In smartctl database 7.3/5528
ATA Version is:   ACS-2, ACS-3 T13/2161-D revision 4
SATA Version is:  SATA 3.1, 6.0 Gb/s (current: 6.0 Gb/s)
Local Time is:    Wed May  7 09:14:22 2026 CEST
SMART support is: Available - device has SMART capability.
SMART support is: Enabled

=== START OF READ SMART DATA SECTION ===
SMART overall-health self-assessment test result: PASSED

General SMART Values:
Offline data collection status:  (0x82) Offline data collection activity
                                        was completed without error.
Self-test execution status:      (   0) The previous self-test routine completed
                                        without error or no self-test has ever
                                        been run.
Total time to complete Offline
data collection:                (  575) seconds.

SMART Attributes Data Structure revision number: 10
Vendor Specific SMART Attributes with Thresholds:
ID# ATTRIBUTE_NAME          FLAG     VALUE WORST THRESH TYPE      UPDATED  WHEN_FAILED RAW_VALUE
  1 Raw_Read_Error_Rate     0x000f   118   099   006    Pre-fail  Always       -       178653928
  3 Spin_Up_Time            0x0003   094   094   000    Pre-fail  Always       -       0
  4 Start_Stop_Count        0x0032   100   100   020    Old_age   Always       -       32
  5 Reallocated_Sector_Ct   0x0033   098   098   010    Pre-fail  Always       -       112
  7 Seek_Error_Rate         0x000f   085   060   030    Pre-fail  Always       -       389215647
  9 Power_On_Hours          0x0032   038   038   000    Old_age   Always       -       54782
 10 Spin_Retry_Count        0x0013   100   100   097    Pre-fail  Always       -       0
 12 Power_Cycle_Count       0x0032   100   100   020    Old_age   Always       -       31
184 End-to-End_Error        0x0032   100   100   099    Old_age   Always       -       0
187 Reported_Uncorrect      0x0032   100   100   000    Old_age   Always       -       0
188 Command_Timeout         0x0032   100   100   000    Old_age   Always       -       0
190 Airflow_Temperature_Cel 0x0022   065   050   045    Old_age   Always       -       35 (Min/Max 25/50)
194 Temperature_Celsius     0x0022   035   050   000    Old_age   Always       -       35 (0 18 0 0 0)
196 Reallocated_Event_Count 0x0032   094   094   000    Old_age   Always       -       106
197 Current_Pending_Sector  0x0012   100   100   000    Old_age   Always       -       8
198 Offline_Uncorrectable   0x0010   100   100   000    Old_age   Offline      -       0
199 UDMA_CRC_Error_Count    0x003e   200   200   000    Old_age   Always       -       0

SMART Error Log Version: 1
ATA Error Count: 3 (device log contains only the most recent five errors)

Error 3 occurred at disk power-on lifetime: 54120 hours (2255 days + 0 hours)
  When the command that caused the error occurred, the device was active or idle.

  Commands leading to the command that caused the error were:
  CR FR SC SN CL CH DH DC   Powered_Up_Time  Command/Feature_Name
  -- -- -- -- -- -- -- --  ----------------  --------------------
  60 00 08 ff ff ff 4f 00  15d+03:22:11.427  READ FPDMA QUEUED

SMART Self-test log structure revision number 1
Num  Test_Description    Status                  Remaining  LifeTime(hours)  LBA_of_first_error
# 1  Short offline       Completed without error       00%     54780         -
# 2  Extended offline    Completed without error       00%     54203         -

Selective Self-tests/Logging not supported
